{
  "schemaId": "steward.ci-plan",
  "schemaVersion": 1,
  "projectId": "steward-example",
  "profileSha256": "sha256:80cc90512e852ab319d46c2bc09026673e688416c9df5706477223c0274f7c6e",
  "verificationCatalogFingerprint": "sha256:48268b9e7b9aa7c6e7e47d17ae1bf0ecd1cb9235826cabc7e299e8531494fd5c",
  "requiredPlatforms": [
    "linux",
    "windows"
  ],
  "fullCaseIds": [
    "selector-contract",
    "core-typecheck",
    "closed-loop-typecheck",
    "linux-integration",
    "windows-integration"
  ],
  "entries": [
    {
      "id": "selector-contract",
      "kind": "selector",
      "platform": "linux",
      "shardIndex": 1,
      "shardCount": 1,
      "caseIds": [
        "selector-contract"
      ]
    },
    {
      "id": "linux-01-of-02",
      "kind": "platform",
      "platform": "linux",
      "shardIndex": 1,
      "shardCount": 2,
      "caseIds": [
        "core-typecheck",
        "linux-integration"
      ]
    },
    {
      "id": "linux-02-of-02",
      "kind": "platform",
      "platform": "linux",
      "shardIndex": 2,
      "shardCount": 2,
      "caseIds": [
        "closed-loop-typecheck"
      ]
    },
    {
      "id": "windows-01-of-01",
      "kind": "platform",
      "platform": "windows",
      "shardIndex": 1,
      "shardCount": 1,
      "caseIds": [
        "windows-integration"
      ]
    }
  ],
  "contentDigest": "sha256:9fc39447b52a0b9e85baca6383e93ec3dae28b6dfc28e9fd9c4f25b471bc648d"
}
